source_id,timestamp,text,n_comment,url
post_d69ec6885bf6909fd4a5203334e18e65,2025-01-31T08:00:00.000000,"บัตร Krungthai Travel Debit Card ส่งลูกเรียนต่อนอก โอนเงินค่าเทอม  ออมเงินในบัญชีก็ได้ดอกเบี้ยก้อนโตถึง  2.5%
สมัครเลยที่แอป Krungthai NEXT:
https://krungthainext.onelink.me/pfZZ/y4evdprn
*เงื่อนไขเป็นไปตามที่ทางธนาคารกำหนด
#เอกสิทธิ์แห่งประสบการณ์ที่เหนือกว่าเดิม
#KrungthaiTravelDebitCard #KrungthaiTravelCard #krungthai #กรุงไทย",529,https://www.facebook.com/krungthaibank/posts/pfbid0km91tUmHhqxvMMLDFuXoh9zVtUiSY1zKfNt1QfzpHgxLTrWbzL6ysYGSVfJqqQal
post_b0d5345a7bc2ce5490ee453658f6d2a6,2025-01-27T17:00:00.000000,"มาแล้ว รวมเรื่องน่ารู้ของสลากหกหลักแบบดิจิทัลและสลากตัวเลขสามหลักในปี 2567!
สนใจเพิ่มเติมสามารถดูได้ที่เมนู สลากหกหลัก และ สลากตัวเลขสามหลักที่ แอปฯ เป๋าตัง! 
*เงื่อนไขเป็นไปตามที่สำนักงานสลากกินแบ่งรัฐบาลกำหนด
#krungthai #กรุงไทย",6,https://www.facebook.com/krungthaibank/posts/pfbid034oMQ5A61bYWFY97yip6ZEAnRZA2Vos2eEK7VZzrkWNkM2QpeCFGnxejN2DsYQa6cl
post_4b468d289f3796d9c6b94554bcc4448d,2025-01-27T10:00:00.000000,"ร่วมรำลึกถึงความเสียสละของทหารกล้า
ในวันทหารผ่านศึก
กรุงไทยร่วมกับมูลนิธิสงเคราะห์ครอบครัวทหารผ่านศึก ในพระราชูปถัมภ์ฯ ขอเชิญชวนทุกท่านร่วมซื้อ ดอกป๊อปปี้ ที่ระลึกวันทหารผ่านศึก ในราคาดอกละ 20 บาท เพื่อนำรายได้ไปช่วยเหลือครอบครัวของทหาร ตำรวจ พลเรือน และอาสาสมัครที่อุทิศตน ปฏิบัติหน้าที่ปกป้องแผ่นดินไทย
มาร่วมแสดงความขอบคุณและส่งต่อกำลังใจ
ให้ครอบครัวผู้เสียสละ 
 ซื้อดอกป๊อปปี้ได้ที่สาขาธนาคารกรุงไทย
ทั่วประเทศ วันนี้ – 20 ก.พ. 2568 
ค้นหาสาขาใกล้คุณ คลิก https://krungthai.com/link/branch-poppy2025-fb
#Krungthai #กรุงไทย 
#วันทหารผ่านศึก #ดอกป๊อปปี้",1600,https://www.facebook.com/krungthaibank/posts/pfbid02uWjC5bjYsv7bpGaitPyPthi4ZMhQH1uNdvcuaiBJheZHz8t6g1bA6BZMmKmePuRNl
post_78592be8f8a34e0bbdb9bc31632bce9c,2025-01-25T10:24:00.000000,"ไม่ว่าจะลงทุนแบบไหน ก็ต้องมีความรู้จริง! มาจัดเต็มพื้นฐานการลงทุน และเทคนิคต่างๆ ได้ที่ #FinFit การเงินฟิต ชีวิตแข็งแรง 
 ทุกอย่างฟรี! ไม่มีค่าใช้จ่าย
เช็กสุขภาพการเงินง่ายๆ กับคำถาม 5 ข้อ 
ฟิตกับคอร์สเรียนจาก 6 กูรูทางการเงินตัวจริง
เน้นให้คนไทยจัดการหนี้ได้ บริหารเงินเป็น และต่อยอดความมั่งคั่ง
#FinFit #การเงินฟิตชีวิตแข็งแรง #krungthai #กรุงไทย",20,https://www.facebook.com/krungthaibank/posts/pfbid03VnHYbFPsJ4kmZ2na9MSi4DKgSVmirtMnyrDRMDGAZXnApZC2Lk5GaMx3xXcndfVl
post_8cf8ee8aec8ba784647eb883c66ec212,2025-01-24T20:09:00.000000,"""ขยะไม่ใช่ขยะ แต่เป็นทรัพยากรที่รอการจัดการ"" - ดร.สมไทย วงษ์เจริญ ผู้ก่อตั้งวงษ์พาณิชย์
กนกพล วงษ์เจริญ ทายาทวงษ์พาณิชย์ พลิกโฉมธุรกิจรีไซเคิล 50 ปีของครอบครัว ต่อยอดด้วยเทคโนโลยีแปรรูปขยะที่รีไซเคิลไม่ได้ เป็นเชื้อเพลิงทดแทนถ่านหิน ปัจจุบันผลิตได้ 1-2 หมื่นตัน/ปี เทียบกับขยะไทย 7 หมื่นตัน/วัน พร้อมพัฒนาต่อด้วย AI เพื่อจัดการขยะอย่างมีประสิทธิภาพ สร้างคุณค่าจากสิ่งที่คนมองข้าม
อ่านเรื่องราวทั้งหมดของคุณกนกพล และ วงษ์พาณิชย์ เวสท์ ทู เอ็นเนอร์จี ได้ที่นี่ https://krungthai.com/link/sme-wongpanit-fb
สามารถติดตามข่าวสารและข้อมูลสำคัญในการทำธุรกิจแบบนี้ เพื่อช่วยให้ SME ไม่พลาดโอกาสทางธุรกิจ ได้ที่ LINE Krungthai SME คลิก https://lin.ee/jr4Hf8W
#Krungthai #กรุงไทย #กรุงไทยSME #KrungthaiSME #Wongpanit #วงษ์พาณิชย์ #พลิกธุรกิจไทยสู่ความยั่งยืน",59,https://www.facebook.com/krungthaibank/posts/pfbid02dbaKESxdNNiD9NZtfcsYLtQi8JXU5Eq6APFchLa4jvdkXsG5dG7XFUreg6jmUDovl
post_bcfad72b131855f12366c23a0d75f628,2025-01-24T12:00:00.000000,"สมรสแบบไหนก็ไม่ติด
เข้า Gold Wallet
ออมทองเตรียมสินสอดไว้
เนื้อคู่มาเมื่อไหร่ แต่งได้เลย
#อยากแต่งกับใคร บอกแล้ว Tag เล้ย",258,https://www.facebook.com/krungthaibank/posts/pfbid02aYew68HjQyNMfujd22gSBJcrVRXmGvBX4iyTihzAFXrGYD5Pq1tsn6q6xWv39UUdl
post_53249407ff2a0dd54e1df24a3cd1d129,2025-01-23T08:00:00.000000,"ช้อปทั่วโลก  แบรนด์ไหน ก็ไม่มีสะดุด  แถมแลกเงินไว้ก็ได้ดอกเบี้ยสูงสุด  2.5% ต่อปี
สมัครเลยที่แอป Krungthai NEXT: https://krungthainext.onelink.me/pfZZ/y4evdprn
*เงื่อนไขเป็นไปตามที่ทางธนาคารกำหนด
#เอกสิทธิ์แห่งประสบการณ์ที่เหนือกว่าเดิม
#KrungthaiTravelDebitCard
#KrungthaiTravelCard
#krungthai #กรุงไทย",457,https://www.facebook.com/krungthaibank/posts/pfbid0BKmURr3RGAmf37wJSn7TvJjpZU4VyAqTLe8KSBMF6mjeeQ9t1NWX1WDgE5vVsXMMl
post_9cd911eb58123c9c4df091296c351a3d,2025-01-22T21:47:00.000000,"บริษัท ซีพีเอฟ (ประเทศไทย) จำกัด (มหาชน) 
บริษัทชั้นนำในธุรกิจเกษตรอุตสาหกรรมและอาหารครบวงจร 
เสนอขาย หุ้นกู้ของบริษัท ซีพีเอฟ (ประเทศไทย) จำกัด (มหาชน) ครั้งที่ 1/2568 
หุ้นกู้ชนิดระบุชื่อผู้ถือ ประเภทไม่ด้อยสิทธิ ไม่มีประกัน และมีผู้แทนผู้ถือหุ้นกู้
ให้แก่ผู้ลงทุนสถาบัน และ/หรือ ผู้ลงทุนรายใหญ่ 
อันดับความน่าเชื่อถือของหุ้นกู้ “A” แนวโน้ม “คงที่” โดยบริษัท ทริสเรทติ้ง จำกัด เมื่อวันที่ 1 เมษายน 2567
หุ้นกู้ ชุดที่ 1 : อายุ 4 ปี
หุ้นกู้ ชุดที่ 2 : อายุ 7 ปี
หุ้นกู้ ชุดที่ 3 : อายุ 10 ปี
จ่ายดอกเบี้ยทุกๆ 6 เดือน (ตลอดอายุหุ้นกู้)
คาดว่าเปิดจองซื้อ เดือนกุมภาพันธ์ 2568
เสนอขายหน่วยละ 1,000 บาท จองซื้อขั้นต่ำ 100,000 บาท และทวีคูณครั้งละ 100,000 บาท  (สำหรับผู้ลงทุนรายใหญ่) 
สอบถามข้อมูลเพิ่มเติม ได้ที่ ธนาคารกรุงไทย ทุกสาขา หรือ โทร. 02-111-1111
รายละเอียดเพิ่มเติม https://krungthai.com/link/bond-cpfth2568-fb
คำเตือน: การลงทุนมีความเสี่ยง ผู้ลงทุนควรศึกษาและทำความเข้าใจลักษณะสินค้า เงื่อนไขผลตอบแทน และความเสี่ยงก่อนตัดสินใจลงทุน ทั้งนี้ ผู้ลงทุนสามารถศึกษารายละเอียดได้จากแบบแสดงรายการข้อมูลการเสนอขายหลักทรัพย์และร่างหนังสือชี้ชวนที่ www.sec.or.th
หมายเหตุ: บริษัทอยู่ระหว่างการยื่นแบบแสดงรายการข้อมูลการเสนอขายหลักทรัพย์และร่างหนังสือชี้ชวนต่อสำนักงาน ก.ล.ต. ซึ่งยังไม่มีผลใช้บังคับ ดังนั้น ข้อมูลจึงอาจมีการแก้ไขเปลี่ยนแปลงได้ การจัดสรรขึ้นอยู่กับดุลยพินิจของผู้จัดการการจัดจำหน่ายหุ้นกู้ เงื่อนไขการจัดจำหน่ายเป็นไปตามที่กำหนดในร่างหนังสือชี้ชวน",3,https://www.facebook.com/krungthaibank/posts/pfbid02Cxfpck1QanNvG3wuLfFrGjCRkdeoM5Fzo2zqbpxxFFT4QFB3Sm3nkpsSmjs9F1Esl
post_92db761cb8804084b268798bd588cf8e,2025-01-17T14:00:00.000000,"เตรียมตัวให้พร้อม! 
 เริ่มชำระค่าสมัครสอบ ภาค ก. ของสำนักงาน ก.พ. ประจำปี 2568 แบบ Paper ผ่าน Krungthai NEXT และเป๋าตัง  ได้ตั้งแต่ 30 ม.ค. 68 เป็นต้นไป 
สะดวก รวดเร็ว ไม่ต้องออกจากบ้าน! อย่าพลาดโอกาสสำคัญนี้นะคะ
#krungthai #กรุงไทย",16,https://www.facebook.com/krungthaibank/posts/pfbid0qZAntpBSsw447nJUQx91Fe4aDQVbpnsiGRS26yF34ZeXHUWN72GqyeEq1AbfbYWQl
post_315d71cabd5cb7cb320f25b93b71356e,2025-01-16T12:00:00.000000,"กรุงไทยขานรับมาตรการ Easy E-Receipt 2.0! สนับสนุนธุรกิจทุกขนาดเพิ่มยอดขายธุรกิจ ด้วยบริการ Krungthai e-Tax Invoice / e-Receipt บนแพลตฟอร์ม Krungthai BUSINESS ใช้งานง่าย ปลอดภัย ช่วยลดต้นทุน ตอบโจทย์ธุรกิจยุคใหม่
 รองรับการออกใบกำกับภาษีอิเล็กทรอนิกส์หลากหลายรูปแบบตามความเหมาะสมของธุรกิจ
 สะดวก ทำรายการผ่านหน้าจอ Portal หรือ ส่งข้อมูลผ่าน API
 สมัครง่าย รวดเร็ว พร้อมทีมที่ปรึกษาดูแลทุกขั้นตอน
 มั่นใจด้วยความปลอดภัยระดับสากล ตรวจสอบข้อมูลได้ 24 ชั่วโมง
 สมัครวันนี้ รับโปรโมชันพิเศษ!
 ฟรี! ค่าธรรมเนียมแรกเข้า
 ค่าธรรมเนียมต่อรายการในอัตราพิเศษ
พร้อมรับตราสัญลักษณ์  e-Tax Invoice & e-Receipt และรับสติ๊กเกอร์โครงการ Easy E-Receipt เพื่อนำไปติดที่หน้าร้านหรือจุดรับชำระเงินต่างๆ
 ตั้งแต่ 1 ม.ค. 68 - 28 ก.พ. 68
เพิ่มเติม คลิก https://krungthai.com/link/krungthai-e-tax-fb
หรือ โทร. 02-111-9999
เงื่อนไขเป็นไปตามที่ธนาคารฯ กำหนด
หมายเหตุ : ธนาคารกรุงไทยได้รับการรับรองจาก ETDA เป็น Tax Service Provider ระดับสูง ครอบคลุมการจัดทำและนำส่งข้อมูลใบกำกับภาษีอิเล็กทรอนิกส์อัตโนมัติแทนผู้ประกอบการรวมถึงสามารถลงลายมือชื่ออิเล็กทรอนิกส์ (Digital Signature) ในนามของธนาคารแทนผู้ประกอบการได้ (CA on Behalf of Krungthai Bank)
#KrungthaieTax #eTax #KrungthaiBUSINESS #EasyEReceipt #ลดหย่อนภาษี #Krungthai #กรุงไทย",417,https://www.facebook.com/krungthaibank/posts/pfbid0341NhuqLtkjU8AtMSTSVS3ixWHquGEUxZUDxV9R61PpCRQPB7EeVkfTx8Xh6txBHQl
post_f1c45a413e26085f68b5aa0e91572292,2025-01-16T11:31:00.000000," โอนเงินไปสิงคโปร์ ง่ายกว่าที่เคย
ไม่ว่าจะค่าเทอม
 หรือค่าใช้จ่ายส่วนตัว แค่มีเบอร์มือถือผู้รับ ก็โอนได้สบายๆ ผ่าน PromptPay International บนแอปฯ Krungthai NEXT
 รับเงินเต็มจำนวน
 เงินเข้าทันที
 ค่าธรรมเนียมเพียง 150 บาท
สะดวก ปลอดภัย ทันใจทุกการโอน
 ดาวน์โหลดแอปฯ Krungthai NEXT แล้วเริ่มโอนได้เลย
 เงื่อนไขเป็นไปตามที่ธนาคารกำหนด
รายละเอียดเพิ่มเติม คลิก https://krungthai.com/link/promptpay-inter-fb
#Krungthai #กรุงไทย
#KrungthaiNEXT #PromptPayInternational #โอนเงินไปสิงคโปร์",0,https://www.facebook.com/krungthaibank/posts/pfbid02wvByMeArFESaU8icvzp73gJ5aEUrYC6br55wzyzpGmaY4eQcrj6AdsrLHW2zXfA3l
post_405eaa902ad8ba2ad213bcca7f321309,2025-01-14T17:00:00.000000,"ระวัง! แอปฯ ""รัฐจ่าย"" ปลอม 
มิจฉาชีพหลอกให้โหลดแอปฯ อ้างเช็กสิทธิ์รัฐบาล แต่แท้จริงคือหลอกเก็บข้อมูลส่วนตัวข้อมูลบัญชีธนาคาร
ป้องกันตัวเองง่าย ๆ ด้วยวิธีนี้:
 อย่าหลงเชื่อบุคคลที่อ้างว่าเป็นเจ้าหน้าที่รัฐ โทรมาขอข้อมูลส่วนตัว
 ห้ามคลิกลิงก์จากแหล่งที่ไม่น่าเชื่อถือ
 ดาวน์โหลดแอปฯ เฉพาะจาก Official Store (App Store, Google Play, AppGallery)
 ตรวจสอบชื่อผู้พัฒนาแอปฯ ต้องเป็น กรมบัญชีกลางนั้น
 กรอกข้อมูลลงทะเบียนด้วยตนเองเท่านั้น ไม่บอกข้อมูลส่วนตัว รหัสต่างๆ กับบุคคลอื่นเด็ดขาด
สำคัญ: หน่วยงานรัฐไม่มีการโทรขอข้อมูลส่วนตัวจากประชาชนโดยตรง
หากพบเหตุการณ์น่าสงสัย แจ้ง Krungthai Call Center: 02-111-1111 กด 108
#Krungthai #กรุงไทย #เตือนภัย #แอปปลอม",15,https://www.facebook.com/krungthaibank/posts/pfbid037wQWeEsR2cBVKJyY7iVoyY5UeAoMnEBpQ68qpSRW1fcRJfjr81H93kdy9r3x9M5Ul
post_2726e9a4686c9a9159d3aff3cc2e97a8,2025-01-14T14:24:00.000000,"ปักหมุดสายกิน ลดฟิน อิ่มคุ้มกว่าใคร ที่ foodpanda กับบัตรเดบิตกรุงไทย
 รับส่วนลด 50 บาท/ท่าน/เดือน
 เมื่อสั่งอาหาร ตั้งแต่ 300 บาทขึ้นไป (หลังหักค่าส่งและส่วนลดทุกประเภท) และชำระผ่านบัตรฯ ที่แอปพลิเคชัน foodpanda
 กรอกโค้ดส่วนลด : KTBEC50
(จำกัด 1 ท่าน/สิทธิ์/เดือน และจำกัด 3,000 สิทธิ์/เดือน รวมทั้งสิ้น 9,000 สิทธิ์ ตลอดระยะเวลารายการส่งเสริมการขาย)
 วันที่ 1 ม.ค. 68 – 31 มี.ค. 68
รายละเอียดเพิ่มเติม https://krungthai.com/.../debit-foodpanda-exclusive-facebook
*เงื่อนไขเป็นไปตามที่ธนาคารกำหนด
ไม่พลาดโปรปังตลอดปี ต้องมีแล้ว บัตรเดบิตกรุงไทย
สมัครง่าย ที่ธนาคารกรุงไทยทุกสาขา
#กรุงไทย #Krungthai #บัตรเดบิตกรุงไทย #KrungthaiDebitCard #KrungthaiDebitCardPromotion",3,https://www.facebook.com/krungthaibank/posts/pfbid0Lv5pSEfNNi4SFkEkym845P9VH3MukaRaxk5hV7f7PshNKuUzg2aJb3tqwGAJEsKwl
post_0b93319e69a99d8bd1f3315526c0d28d,2025-01-14T12:00:00.000000,"สำหรับผู้เงินเดือนผ่านกรุงไทย สินเชื่อกรุงไทยเปย์เดะ วงเงินสูง อนุมัติไว ดอกเบี้ยเพียง 14.445% ต่อปี* สมัครง่ายผ่านแอป Krungthai NEXT
กรุงไทยเปย์เดะ
เงินก้อนสำหรับผู้รับเงินเดือนผ่านบัญชีกรุงไทย
วงเงินสูงสุด 1 ล้านบาท  
รายได้ต่อเดือน 15,000 บ.ขึ้นไป
ผ่อนได้ตั้งแต่ 12-60 เดือน
อนุมัติไว ไม่ต้องค้ำประกัน
 สมัครที่ แอป Krungthai NEXT  >> https://info.krungthai.com/JW1I?extsrc=NT-DGL-FB-KTB-PD
รายละเอียด คลิก >> https://krungthai.com/link/paydae-fb
*อัตราดอกเบี้ย MRR+7% ต่อปี | กู้เท่าที่จำเป็นและชำระคืนไหว
(MRR = 7.445% ต่อปี ณ 1 ม.ค. 68) 
อัตราดอกเบี้ยลอยตัวสามารถเปลี่ยนเพิ่มขึ้นหรือลดลงได้
#กรุงไทยเปย์เดะ #สินเชื่อสำหรับผู้รับเงินเดือนผ่านกรุงไทย #krungthai #กรุงไทย",12,https://www.facebook.com/krungthaibank/posts/pfbid0MyTda8pi7tqqNezCyzDTBeCSBxnx3N8ynLmBkbosAtLEmV2JL9VZzQ2ecw9J5Zhql
post_da30bb3d94e0b0e3a136192496f1c7fb,2025-01-13T20:30:00.000000,"โครงการ ""คุณสู้ เราช่วย"" ปิดหนี้ได้ไว ไปต่อได้เร็ว มี 2 มาตรการ
 ธปท. และพันธมิตรร่วมช่วยเหลือลูกหนี้รายย่อยและ SMEร ด้วย 2 มาตรการ: 
 จ่ายตรง คงทรัพย์
สำหรับลูกหนี้สินเชื่อบ้าน รถ และ SMEร ขนาดเล็กที่มีวงเงินหนี้ไม่สูงมาก ให้สามารถรักษาทรัพย์สินที่เป็นหลักประกันทั้งบ้าน รถ และสถานประกอบการไว้ได้
 จ่าย ปิด จบ
สำหรับลูกหนี้รายย่อยที่เป็นหนี้เสียและยอดหนี้ไม่สูง ยอดรวมไม่เกิน 5,000 บาท/บัญชี
.
 สามารถลงทะเบียนผ่านเว็บไซต์ธนาคารแห่งประเทศไทย
https://www.bot.or.th/khunsoo  ได้ตั้งแต่ 12 ธ.ค. 67 - 28 ก.พ. 68
 ลูกค้าธนาคารกรุงไทยสามารถขอคำแนะนำในการลงทะเบียนได้ที่ธนาคารกรุงไทยทุกสาขา
.
สอบถามรายละเอียดเพิ่มเติมที่ Krungthai Contact Center 02 111 1111 no 99 หรือ ลายด่วนแบงก์ชาติ โทร. 1213
ข้อมูลเพิ่มเติม คลิก https://krungthai.com/link/khunsoo-fb
#คุณสู้เราช่วย #Krungthai #กรุงไทย #สินเชื่อ #มาตรการจ่ายตรงคงทรัพย์ #แบงก์ชาติ",6,https://www.facebook.com/krungthaibank/posts/pfbid02mvPkcSeFhEatg3G6Bf59JXvhPzQWSN9JjRwZh6eaFLSDwqGakV4azKCBxR1gHKE3l
post_2b41813a7d6f77b4d51161a2fe33d6c1,2025-01-13T18:30:00.000000,"3 ทริค พ่อแม่ยุคใหม่
สร้างอิสระให้ลูกเลือกทางเดินเอง
1. ฟังความคิดของลูกก่อนให้คำแนะนำ
2. สนับสนุนสิ่งที่ลูกอยากลองทำ
3. ให้ลูกได้ลองผิดลองถูกในแบบที่ปลอดภัย
พ่อพ่อ แม่แม่ มีวิธีไหนอีก แชร์กันหน่อย",183,https://www.facebook.com/krungthaibank/posts/pfbid02qgvTbysHMsHi3Ld24rAxumbB7NLKF2ePfXDcxTmYYCXvLzmiSs3FEsst2nNe5aMXl
